,id,_title,_description,keywords,year,_date,_source,_depicts,_width,_height
330,001RR005,Avenida Central,"Vista geral da Avenida Central (atual Avenida Rio Branco), em direção à Prainha (atual Praça Mauá), na altura do cruzamento com a Rua de São José. A cúpula que se vê à esquerda, no centro da imagem, pertencia ao edifício do jornal O País.","Augusto Malta,REPRODUÇÃO FOTOMECÂNICA/ Papel",1906,20-02-1906,"<a href=""http://acervos.ims.com.br/portals/#/detailpage/77553>Instituto Moreira Salles</a>",nan,14,"8,5"
331,001SW001001,O bairro do Catete e o Pão de Açucar,"Vista do Morro da Glória e do bairro do Catete, a partir do Morro de Santa Teresa. Ao fundo, os morros Cara de Cão , Pão de Açúcar e a Urca.","Augusto Stahl,FOTOGRAFIA/ Papel",1862,1861/1863,"<a href=""http://acervos.ims.com.br/portals/#/detailpage/17199>Instituto Moreira Salles</a>",nan,"24,5","19,4"
332,001SW001003,Mercado da Glória,"vista do Bairro da Glória, à direita o edifício da Mercado Municipal, a igreja da Glória e a fábrica City.","Augusto Stahl,FOTOGRAFIA/ Papel",1862,1861/1863,"<a href=""http://acervos.ims.com.br/portals/#/detailpage/17201>Instituto Moreira Salles</a>",nan,"26,1","20,3"
333,002008OBAC008,Demolição do Morro do Castelo para a construção da avenida Central,"A abertura de uma avenida que cortasse o centro da cidade de ponta a ponta estava prevista quando começou-se as obras no porto do Rio de Janeiro, no início do século XX. Foi então rasgado um caminho, em linha reta, que ia da Praia da Ajuda à Prainha, e a maioria das ruas do entorno foi arrasada, além de desapropriados inúmeros imóveis. A primeira casa derrubada foi em março de1904 e já em setembro o prefeito Pereira Passos, o engenheiro  Paulo de Frontin (nomeado chefe das obras), Rodrigues Alves e Lauro Müller podiam percorrer a avenida de 1.996 metros de comprimento e 33 metros de largura. Com pavimentação artística de mestre calceteiros cedidos pela Câmara de Lisboa e ornamentada com paus-brasil e jambeiros, a Avenida Central foi inaugurada em 1905.","Torres,FOTOGRAFIA/ Papel",1904,01-01-1904,"<a href=""http://acervos.ims.com.br/portals/#/detailpage/18244>Instituto Moreira Salles</a>",nan,"24,0","16,0"
334,002008OBAC010,Demolição do Morro do Castelo,"A abertura de uma avenida que cortasse o centro da cidade de ponta a ponta estava prevista quando começou-se as obras no porto do Rio de Janeiro, no início do século XX. Foi então rasgado um caminho, em linha reta, que ia da Praia da Ajuda à Prainha, e a maioria das ruas do entorno foi arrasada, além de desapropriados inúmeros imóveis. A primeira casa derrubada foi em março de1904 e já em setembro o prefeito Pereira Passos, o engenheiro  Paulo de Frontin (nomeado chefe das obras), Rodrigues Alves e Lauro Müller podiam percorrer a avenida de 1.996 metros de comprimento e 33 metros de largura. Com pavimentação artística de mestre calceteiros cedidos pela Câmara de Lisboa e ornamentada com paus-brasil e jambeiros, a Avenida Central foi inaugurada em 1905.","Torres,FOTOGRAFIA/ Papel",1904,01-01-1904,"<a href=""http://acervos.ims.com.br/portals/#/detailpage/18245>Instituto Moreira Salles</a>",nan,"24,0","16,0"
335,002051AM001001,Vista noturna do Pavilhão de Caça e Pesca da Exposição Internacional do Centenário da Independência do Brasil,"Vista noturna da Exposição Internacional do Centenário da Independência do Brasil. No primeiro plano, o Pavilhão de Caça e Pesca. Concebida pelo prefeito engenheiro Carlos Sampaio, a exposição foi inaugurada pelo presidente Epitácio Pessoa no dia 07.09.1922. Os pavilhões espalhavam-se desde o final da avenida Rio Branco, junto ao Palácio Monroe, que sediava a Comissão Executiva, seguindo até a Ponta do Calabouço pela avenida das Nações (atual Presidente Wilson), através da esplanada recém criada com o desmonte do Morro do Castelo, seguindo ainda na direção da praça XV de Novembro. O Morro do Castelo veio abaixo, depois de inúmeros e antigos projetos com ""propósitos higiênicos e urbanísticos"", especificamente para alocar esse evento. A exposição permaneceu aberta durante um ano, sendo visitada por milhares de turistas brasileiros e estrangeiros. Alguns pavilhões sobreviveram ao evento: o Pavilhão das Indústrias abriga hoje o Museu Histórico Nacional; o Pavilhão francês, réplica do ""Petit Trianon"", foi doado pela França para a Academia Brasileira de Letras; o da Administração é atualmente a sede do Museu da Imagem e do Som e o da Estatística, localiza-se ao lado do Clube da Aeronáutica.","Augusto Malta,FOTOGRAFIA/ Papel",1922,01-01-1922,"<a href=""http://acervos.ims.com.br/portals/#/detailpage/63800>Instituto Moreira Salles</a>",nan,"22,7","16,9"
336,002051AM001003,"Vista do Pavilhão da Itália, integrante da Exposição Internacional do Centenário da Independência do Brasil","Vista do Pavilhão da Itália, integrante da Exposição Internacional do Centenário da Independência do Brasil de 1922. Concebida pelo prefeito engenheiro Carlos Sampaio, a exposição foi inaugurada pelo presidente Epitácio Pessoa no dia 07.09.1922. Os pavilhões espalhavam-se desde o final da avenida Rio Branco, junto ao Palácio Monroe, que sediava a Comissão Executiva, seguindo até a Ponta do Calabouço pela avenida das Nações (atual Presidente Wilson), através da esplanada recém criada com o desmonte do Morro do Castelo, seguindo ainda na direção da praça XV de Novembro. O Morro do Castelo veio abaixo, depois de inúmeros e antigos projetos com ""propósitos higiênicos e urbanísticos"", especificamente para alocar esse evento. A exposição permaneceu aberta durante um ano, sendo visitada por milhares de turistas brasileiros e estrangeiros. Alguns pavilhões sobreviveram ao evento: o Pavilhão das Indústrias abriga hoje o Museu Histórico Nacional; o Pavilhão francês, réplica do ""Petit Trianon"", foi doado pela França para a Academia Brasileira de Letras; o da Administração é atualmente a sede do Museu da Imagem e do Som e o da Estatística, localiza-se ao lado do Clube da Aeronáutica.","Augusto Malta,FOTOGRAFIA/ Papel",1922,01-01-1922,"<a href=""http://acervos.ims.com.br/portals/#/detailpage/63801>Instituto Moreira Salles</a>",nan,"22,7","17,2"
337,002051AM001004,Vista da Exposição Internacional do Centenário da Independência do Brasil,"Vista da Exposição Internacional do Centenário da Independência do Brasil. Os pavilhões espalhavam-se desde a avenida Rio Branco até a Ponta do Calabouço, na esplanada recém criada com o desmonte do Morro do Castelo, seguindo ainda na direção da praça XV de Novembro. Pode-se identificar na avenida Rio Branco, no plano central da imagem e da esquerda para a direita, as seguintes edificações: o Palácio Monroe, as torres da igreja de Santa Luzia, os fundos da Biblioteca Nacional, da Escola de Belas Artes e do Teatro Municipal.","Augusto Malta,FOTOGRAFIA/ Papel",1922,01-01-1922,"<a href=""http://acervos.ims.com.br/portals/#/detailpage/63802>Instituto Moreira Salles</a>",nan,"22,9","16,9"
338,002051AM001005,Vista parcial da Exposição Internacional do Centenário da Independência do Brasil,"Vista parcial da Exposição Internacional do Centenário da Independência do Brasil, em 1922. À esquerda destaca-se a ""Torre da Exposição"", como ficou conhecida, com cerca de 30 metros de altura, de onde jorravam focos de luz que dominavam todo o conjunto. Concebida pelo prefeito engenheiro Carlos Sampaio, a exposição foi inaugurada pelo presidente Epitácio Pessoa no dia 07.09.1922. Os pavilhões espalhavam-se desde o final da avenida Rio Branco, junto ao Palácio Monroe, que sediava a Comissão Executiva, seguindo até a Ponta do Calabouço pela avenida das Nações (atual Presidente Wilson), através da esplanada recém criada com o desmonte do Morro do Castelo, seguindo ainda na direção da praça XV de Novembro. O Morro do Castelo veio abaixo, depois de inúmeros e antigos projetos com ""propósitos higiênicos e urbanísticos"", especificamente para alocar esse evento. A exposição permaneceu aberta durante um ano, sendo visitada por milhares de turistas brasileiros e estrangeiros. Alguns pavilhões sobreviveram ao evento: o Pavilhão das Indústrias abriga hoje o Museu Histórico Nacional; o Pavilhão francês, réplica do ""Petit Trianon"", foi doado pela França para a Academia Brasileira de Letras; o da Administração é atualmente a sede do Museu da Imagem e do Som e o da Estatística, localiza-se ao lado do Clube da Aeronáutica.","Augusto Malta,FOTOGRAFIA/ Papel",1922,01-01-1922,"<a href=""http://acervos.ims.com.br/portals/#/detailpage/63803>Instituto Moreira Salles</a>",nan,"22,8","17,2"
339,002051AM002002,"Praça XV de novembro e arredores vistos do alto do morro do Castelo, ao fundo, Ilha das Cobras e ponte Almirante Alexandrino","Vista panorâmica dos arredores da praça 15 de Novembro, a partir do morro do Castelo, com a ilha das Cobras ao fundo. Destaca-se a Igreja de São José no centro da imagem, na rua Primeiro de Março (antiga rua Direita).","Augusto Malta,FOTOGRAFIA/ Papel",1920,1915/1925,"<a href=""http://acervos.ims.com.br/portals/#/detailpage/63804>Instituto Moreira Salles</a>",nan,23,"16,8"
340,002051AN009,"Vista aérea do Rio de Janeiro, tomada do interior do Graf Zepellin","Vista do Rio de Janeiro, tomada a partir do interior do Graf Zepellin. À esquerda, detalhe da área externa do dirigível. Ao fundo, vê-se os morros do Pão de Açúcar, Urca e Babilônia, entrevendo-se ainda a Escola Militar, que seria destruída em 1935. O bairro da Urca já está formado. Em 1930, o Graf Zeppelin (LZ 127) fez o primeiro vôo experimental ao Brasil, saindo de Friedrichschafen, Alemanha, para Recife e Rio de Janeiro, e a partir de 1932 manteve linha regular ao Brasil. O Hindenburg (LZ 129) viaja para o Brasil em 1936 e, em 1937 é destruído por trágico incêndio em Lakehurst, Nova York. Durante os Jogos Olímpicos de Berlim, em 1936, os dirigíveis foram pintados com os anéis símbolos das Olimpíadas e a suástica, símbolo do partido nazista alemão. Ao todo foram construídos 119 zepellins, entre 1900 (o LZ 1) e 1938.","Anônimo,FOTOGRAFIA/ Papel",1935,1933/1937,"<a href=""http://acervos.ims.com.br/portals/#/detailpage/63733>Instituto Moreira Salles</a>",nan,"13,8","8,7"
341,002051AN010,"Vista aérea de Copacabana, no Rio de Janeiro, tomada do interior do Graf Zepellin","Vista aérea de Copacabana, no Rio de Janeiro, tomada do interior do Graf Zepellin. À direita pode-se ver os motores externos do dirigível. Ao fundo, vê-se o morro do Pão de Açúcar. Em 1930, o Graf Zeppelin (LZ 127) fez o primeiro vôo experimental ao Brasil, saindo de Friedrichschafen, Alemanha, para Recife e Rio de Janeiro, e a partir de 1932 manteve linha regular ao Brasil. O Hindenburg (LZ 129) viaja para o Brasil em 1936 e, em 1937 é destruído por trágico incêndio em Lakehurst, Nova York. Durante os Jogos Olímpicos de Berlim, em 1936, os dirigíveis foram pintados com os anéis símbolos das Olimpíadas e a suástica, símbolo do partido nazista alemão. Ao todo foram construídos 119 zepellins, entre 1900 (o LZ 1), e 1938.","Anônimo,FOTOGRAFIA/ Papel",1935,1933/1937,"<a href=""http://acervos.ims.com.br/portals/#/detailpage/63734>Instituto Moreira Salles</a>",nan,"13,7","8,7"
342,002054VIAN004,"Pedra do Arpoador e trilho de bonde, tomados das cercanias da residência da família Barreira Vianna, em Ipanema na esquina da avenida Vieira Souto e rua Francisco Otaviano.",nan,"José Baptista Barreira Vianna,FOTOGRAFIA/ Papel",1902,01-01-1902,"<a href=""http://acervos.ims.com.br/portals/#/detailpage/18203>Instituto Moreira Salles</a>",nan,nan,nan
343,002054VIAN012,"Residência da família Barreira Vianna, em Ipanema na esquina da avenida Vieira Souto e rua Francsico Otaviano. Ilhas Cagarras ao fundo.",nan,"José Baptista Barreira Vianna,FOTOGRAFIA/ Papel",1903,01-01-1903,"<a href=""http://acervos.ims.com.br/portals/#/detailpage/18205>Instituto Moreira Salles</a>",nan,nan,nan
344,002054VIAN014,"Residência da família Barreira Vianna, em Ipanema na esquina da avenida Vieira Souto e rua Francisco Otaviano. Ilhas Cagarras ao fundo.",nan,"José Baptista Barreira Vianna,FOTOGRAFIA/ Papel",1903,01-01-1903,"<a href=""http://acervos.ims.com.br/portals/#/detailpage/18206>Instituto Moreira Salles</a>","<a href=""http://www.wikidata.org/entity/Q468540>Ipanema</a>",nan,nan
345,002054VIAN031,"Residência da família Barreira Vianna, em Ipanema na esquina da avenida Vieira Souto e rua Francisco Otaviano. Pão de Açúcar e praia de Copacabana ao fundo.",nan,"José Baptista Barreira Vianna,FOTOGRAFIA/ Papel",1900,1900/1903,"<a href=""http://acervos.ims.com.br/portals/#/detailpage/18209>Instituto Moreira Salles</a>",nan,nan,nan
346,002054VIAN040,Bonde nas proximidades da pedra do Arpoador,nan,"José Baptista Barreira Vianna,FOTOGRAFIA/ Papel",1900,1900/1903,"<a href=""http://acervos.ims.com.br/portals/#/detailpage/18212>Instituto Moreira Salles</a>",nan,nan,nan
347,002080BR0206,"Igreja de Santa Luzia, è direita, e Igreja de São Sebastião, no alto do morro do Castelo",nan,"Guilherme Santos,DIAPOSITIVO/ Vidro",1915,01-01-1915,"<a href=""http://acervos.ims.com.br/portals/#/detailpage/16551>Instituto Moreira Salles</a>",nan,11,"4,5"
348,002080BR0207,Largo do Machado,nan,"Guilherme Santos,DIAPOSITIVO/ Vidro",1917,01-01-1917,"<a href=""http://acervos.ims.com.br/portals/#/detailpage/16552>Instituto Moreira Salles</a>",nan,11,"4,5"
349,002080RJ1503,"Senado Federal, enterro de Pinheiro Machado","Pinheiro Machado foi assassinado com uma punhalada pelas costas por Manso de Paiva, às 16h30 de 8 de setembro de 1915. O senador foi atacado no saguão do Hotel dos Estrangeiros, no Flamengo, onde visitaria Rubião Júnior, político do Partido Republicano Paulista. Vinha do Senado e estava em companhia dos deputados federais paulistas Cardoso de Almeida e Bueno de Andrade.","Guilherme Santos,DIAPOSITIVO/ Vidro",1915,01-09-1915,"<a href=""http://acervos.ims.com.br/portals/#/detailpage/82305>Instituto Moreira Salles</a>",nan,11,"4,5"
350,002080RJ1504,"Senado Federal, enterro de Pinheiro Machado","Pinheiro Machado foi assassinado com uma punhalada pelas costas por Manso de Paiva, às 16h30 de 8 de setembro de 1915. O senador foi atacado no saguão do Hotel dos Estrangeiros, no Flamengo, onde visitaria Rubião Júnior, político do Partido Republicano Paulista. Vinha do Senado e estava em companhia dos deputados federais paulistas Cardoso de Almeida e Bueno de Andrade.","Guilherme Santos,DIAPOSITIVO/ Vidro",1915,01-09-1915,"<a href=""http://acervos.ims.com.br/portals/#/detailpage/82306>Instituto Moreira Salles</a>",nan,11,"4,5"
351,002080RJ1505,Carreata pela visita do presidente argentino Justo,"Em 1935, o presidente Getúlio Vargas visitou Buenos Aires, em retribuição à visita de Justo.","Guilherme Santos,DIAPOSITIVO/ Vidro",1933,01-10-1933,"<a href=""http://acervos.ims.com.br/portals/#/detailpage/82308>Instituto Moreira Salles</a>",nan,11,"4,5"
352,002080RJ1506,Carreata pela visita do presidente argentino Justo,"Em 1935, o presidente Getúlio Vargas visitou Buenos Aires, em retribuição à visita de Justo.","Guilherme Santos,DIAPOSITIVO/ Vidro",1933,01-10-1933,"<a href=""http://acervos.ims.com.br/portals/#/detailpage/82307>Instituto Moreira Salles</a>",nan,11,"4,5"
353,002080RJ2807,Desfile de corsos durante o carnaval,nan,"Guilherme Santos,DIAPOSITIVO/ Vidro",1927,1922/1932,"<a href=""http://acervos.ims.com.br/portals/#/detailpage/18174>Instituto Moreira Salles</a>",nan,11,"4,5"
354,002080RJ2815,Carnaval,nan,"Guilherme Santos,DIAPOSITIVO/ Vidro",1932,01-01-1932,"<a href=""http://acervos.ims.com.br/portals/#/detailpage/18175>Instituto Moreira Salles</a>",nan,11,"4,5"
355,0071824cx001-01,Vista do Pão de Açúcar a partir da Fortaleza de Santa Cruz,"Morro do Pão de Açúcar visto a partir da Fortaleza de Santa Cruz, em Niterói.","Marc Ferrez,NEGATIVO/ Vidro",1890,1885/1895,"<a href=""http://acervos.ims.com.br/portals/#/detailpage/66439>Instituto Moreira Salles</a>",nan,"24,0","18,0"
356,0071824cx001-02,"Entrada da Baía de Guanabara, Pão de Açúcar","Baía de Guanabara, Pão de Açúcar e Fortaleza de Santa Cruz.","Marc Ferrez,NEGATIVO/ Vidro",1890,1885/1895,"<a href=""http://acervos.ims.com.br/portals/#/detailpage/66547>Instituto Moreira Salles</a>","<a href=""http://www.wikidata.org/entity/Q224101>Baía de Guanabara</a>","24,0","18,0"
357,0071824cx001-04,"Largo da Carioca, chafariz com 35 bicas","Vista do Largo da Carioca, com chafariz ao fundo, já como ponto final de linhas de bonde.","Marc Ferrez,NEGATIVO/ Vidro",1895,1890/1900,"<a href=""http://acervos.ims.com.br/portals/#/detailpage/66440>Instituto Moreira Salles</a>","<a href=""http://www.wikidata.org/entity/Q10316344>Largo da Carioca</a>","24,0","18,0"
358,0071824cx001-05,Vista da Praia de Santa Luzia,Vista tomada da Ponta do Calabouço. À direita vêem-se o Morro do Castelo e a Igreja de Santa Luzia.,"Marc Ferrez,NEGATIVO/ Vidro",1885,1880/1890,"<a href=""http://acervos.ims.com.br/portals/#/detailpage/66441>Instituto Moreira Salles</a>","<a href=""http://www.wikidata.org/entity/Q8678>Rio de Janeiro</a>","24,0","18,0"
359,0071824cx001-06,"Rua Primeiro de Março, Convento do Carmo e Igreja de Nossa Senhora do Carmo à esquerda","Vista do Largo do Paço, Rua Primeiro de Março e  à esquerda, em primeiro plano a Igreja de Nossa Senhora do Monte do Carmo, ainda sem sua torra e ao lado a  Igreja da Ordem Terceira do Carmo. Não havia ainda linha de bondes na rua 7 de setembro.","Marc Ferrez,NEGATIVO/ Vidro",1890,1885/1895,"<a href=""http://acervos.ims.com.br/portals/#/detailpage/16041>Instituto Moreira Salles</a>","<a href=""http://www.wikidata.org/entity/Q10353359>Praça XV de Novembro</a>","18,0","24,0"
360,0071824cx001-08,Pão de Açúcar visto de Niterói,Pão de Açúcar visto a partir de Niterói.,"Marc Ferrez,NEGATIVO/ Vidro",1880,1875/1885,"<a href=""http://acervos.ims.com.br/portals/#/detailpage/66443>Instituto Moreira Salles</a>","<a href=""http://www.wikidata.org/entity/Q224101>Baía de Guanabara</a>","24,0","18,0"
361,0071824cx001-09,Pão de Açúcar visto de Niterói,"Pão de Açúcar, morro da Urca e Fortaleza de Santa Cruz vistos de Niterói","Marc Ferrez,NEGATIVO/ Vidro",1880,1875/1885,"<a href=""http://acervos.ims.com.br/portals/#/detailpage/66444>Instituto Moreira Salles</a>","<a href=""http://www.wikidata.org/entity/Q224101>Baía de Guanabara</a>","24,0","18,0"
362,0071824cx001-10,Vista do Pão de Açúcar a partir da Fortaleza de Santa Cruz,"Morro do Pão de Açúcar e morro da Urca a partir da Fotaleza de Santa Cruz, em Niterói,","Marc Ferrez,NEGATIVO/ Vidro",1880,1875/1885,"<a href=""http://acervos.ims.com.br/portals/#/detailpage/66445>Instituto Moreira Salles</a>",nan,"24,0","18,0"
363,0071824cx001-11,Fortaleza de Santa Cruz,"Fortaleza de Santa Cruz da Barra localiza-se no lado oriental da barra da baía de Guanabara, no bairro de Jurujuba, município de Niterói, no estado do Rio de Janeiro.","Marc Ferrez,NEGATIVO/ Vidro",1890,1885/1895,"<a href=""http://acervos.ims.com.br/portals/#/detailpage/66446>Instituto Moreira Salles</a>",nan,"24,0","18,0"
364,0071824cx001-13,Vista da Fortaleza de Santa Cruz,"Fortaleza de Santa Cruz da Barra localiza-se no lado oriental da barra da baía de Guanabara, no bairro de Jurujuba, município de Niterói, no estado brasileiro do Rio de Janeiro.","Marc Ferrez,NEGATIVO/ Vidro",1890,1885/1895,"<a href=""http://acervos.ims.com.br/portals/#/detailpage/66448>Instituto Moreira Salles</a>",nan,"24,0","18,0"
365,0071824cx001-14,Vista do Pão de Açúcar a partir da Fortaleza de Santa Cruz,"Vista do Pão de Açúcar e da Fortaleza de Santa Cruz, tomada do forte de São Luiz, atualmente denominado Forte Barão do Rio Branco em Niterói.","Marc Ferrez,NEGATIVO/ Vidro",1890,1885/1895,"<a href=""http://acervos.ims.com.br/portals/#/detailpage/66548>Instituto Moreira Salles</a>","<a href=""http://www.wikidata.org/entity/Q224101>Baía de Guanabara</a>","24,0","18,0"
366,0071824cx001-15,Pão de Açúcar visto de Niterói,"Fortaleza de Santa Cruz da Barra localiza-se no lado oriental da barra da baía de Guanabara, no bairro de Jurujuba, município de Niterói, no estado brasileiro do Rio de Janeiro.","Marc Ferrez,NEGATIVO/ Vidro",1890,1885/1895,"<a href=""http://acervos.ims.com.br/portals/#/detailpage/66534>Instituto Moreira Salles</a>",nan,"24,0","18,0"
367,0071824cx003a-04,Igreja de Nossa Senhora da Glória,"Por decreto imperial de 1834, foi criada no Rio de Janeiro a freguesia de Nossa Senhora da Glória, e a 30 de outubro do mesmo ano marcados os seus limites. Essa nova freguesia era um desmembramento da de São José, que já àquele tempo era muito populosa, e compreendia toda a vasta área da cidade, não só da que ainda lhe pertence, mas ia até os confins do bairro da Gávea.\nA freguesia de São João Batista da Lagoa já havia sido instituída anteriormente; entretanto a população de Laranjeiras, Catete e Botafogo, por muito numerosa, sobrecarregava de serviço a de São José.","Marc Ferrez,NEGATIVO/ Vidro",1890,1885/1895,"<a href=""http://acervos.ims.com.br/portals/#/detailpage/66449>Instituto Moreira Salles</a>","<a href=""http://www.wikidata.org/entity/Q10316374>Largo do Machado</a>","18,0","24,0"
368,0071824cx003a-05,Igreja de São Joaquim,"Vista da Igreja de São Joaquim  na Rua Larga, atual avenida Marechal Floriano, erguida em 1758.","Marc Ferrez,NEGATIVO/ Vidro",1890,1885/1895,"<a href=""http://acervos.ims.com.br/portals/#/detailpage/66450>Instituto Moreira Salles</a>",nan,"18,0","24,0"
369,0071824cx003a-06,Igreja de Nossa Senhora da Glória,"Por decreto imperial de 1834, foi criada no Rio de Janeiro a freguesia de Nossa Senhora da Glória, e a 30 de outubro do mesmo ano marcados os seus limites. Essa nova freguesia era um desmembramento da de São José, que já àquele tempo era muito populosa, e compreendia toda a vasta área da cidade, não só da que ainda lhe pertence, mas ia até os confins do bairro da Gávea.\nA freguesia de São João Batista da Lagoa já havia sido instituída anteriormente; entretanto a população de Laranjeiras, Catete e Botafogo, por muito numerosa, sobrecarregava de serviço a de São José.","Marc Ferrez,NEGATIVO/ Vidro",1890,1885/1895,"<a href=""http://acervos.ims.com.br/portals/#/detailpage/66451>Instituto Moreira Salles</a>","<a href=""http://www.wikidata.org/entity/Q10316374>Largo do Machado</a>","18,0","24,0"
370,0071824cx003a-09,Igreja São Francisco de Paula,"Igreja São Francisco de Paula localiza-se no Largo São Francisco de Paula, no centro do Rio de Janeiro. A igreja foi inaugurada oficialmente em 7 de março de 1865, com a presença dos imperadores D. Pedro II e D. Teresa Cristina.","Marc Ferrez,NEGATIVO/ Vidro",1885,1880/1890,"<a href=""http://acervos.ims.com.br/portals/#/detailpage/66452>Instituto Moreira Salles</a>","<a href=""http://www.wikidata.org/entity/Q10316364>Largo de São Francisco de Paula</a>","18,0","24,0"
371,0071824cx004-01,Ilha Fiscal,"Vista da Ilha Fiscal, tomada de uma embarcação. Transferida para a Marinha pelo Ministério da Fazenda, em 1913, a Ilha é hoje parte do Complexo Cultural do Serviço de Documentação da Marinha (DPHDM). Cenário do evento que ficou conhecido como “O Último Baile do Império”, realizado alguns dias antes da Proclamação da República.","Marc Ferrez,NEGATIVO/ Vidro",1885,1880/1890,"<a href=""http://acervos.ims.com.br/portals/#/detailpage/66453>Instituto Moreira Salles</a>",nan,"24,0","18,0"
372,0071824cx004-02,Ilha Fiscal,"Vista da Ilha Fiscal, tomada de uma embarcação. Transferida para a Marinha pelo Ministério da Fazenda, em 1913, a Ilha fiscal é hoje parte do Complexo Cultural do Serviço de Documentação da Marinha (DPHDM). Cenário do evento que ficou conhecido como “O Último Baile do Império”, realizado alguns dias antes da Proclamação da República.","Marc Ferrez,NEGATIVO/ Vidro",1885,1880/1890,"<a href=""http://acervos.ims.com.br/portals/#/detailpage/66454>Instituto Moreira Salles</a>",nan,"24,0","18,0"
373,0071824cx006-01,"Monumento a D. Pedro I no Largo do Rocio, atual praça Tiradentes",Vista da estátua de Dom Pedro I na praça Tiradentes.,"Marc Ferrez,NEGATIVO/ Vidro",1885,1885/1900,"<a href=""http://acervos.ims.com.br/portals/#/detailpage/66456>Instituto Moreira Salles</a>","<a href=""http://www.wikidata.org/entity/Q10353390>Praça Tiradentes</a>","18,0","24,0"
374,0071824cx006-02,"Estátua do General Osório, vendo-se ao fundo o Morro do Castelo","A estátua que homenageia o famoso herói da Guerra do Paraguai, de autoria de Rodolfo Bernardelli, foi inaugurada em 1894 e é o primeiro monumento público do Rio na era republicana. A estátua eqüestre do General Osório mede 8m de altura e, num gesto de audácia, foi feita com o bronze dos canhões tomados pelo Brasil na Guerra do Paraguai.","Marc Ferrez,NEGATIVO/ Vidro",1895,1894/1905,"<a href=""http://acervos.ims.com.br/portals/#/detailpage/66535>Instituto Moreira Salles</a>","<a href=""http://www.wikidata.org/entity/Q10332478>Morro do Castelo</a>', '<a href=""http://www.wikidata.org/entity/Q10277581>General Osorio statue</a>', '<a href=""http://www.wikidata.org/entity/Q4902626>Convento do Carmo</a>', '<a href=""http://www.wikidata.org/entity/Q3361206>Paço Imperial</a>', '<a href=""http://www.wikidata.org/entity/Q10353359>Praça XV de Novembro</a>","18,0","24,0"
375,0071824cx006-03,Monumento a Pedro Alvares Cabral - Largo da Glória,"Estátua criada no ano de comemorações aos 400 anos do descobrimento do Brasil, pelo escultor Rodolfo Bernardeli, em homenagem a Pedro Alvares Cabral.","Marc Ferrez,NEGATIVO/ Vidro",1900,1900/1900,"<a href=""http://acervos.ims.com.br/portals/#/detailpage/66457>Instituto Moreira Salles</a>","<a href=""http://www.wikidata.org/entity/Q1532671>Glória</a>","18,0","24,0"
