,id,_title,_description,keywords,year,_date,_source,_depicts,_width,_height
939,007A5P4F02-028,Museu Nacional,"O Museu Real no Rio de Janeiro foi criado em junho de 1818 por D. João VI. Inicialmente instalado no Campo de Santana, foi transferido para a Quinta da Boa Vista em 1892.  Em 1922 o museu passa a chamar-se Museu Nacional, sendo incorporado à Universidade do Brasil (atual UFRJ) em 1946. A quinta foi construída no século XVIII pelo negociante português Elias Antônio Lopes, num terreno elevado e com exuberante vegetação. Foi dada de presente a D. João VI quando este chegou ao Brasil, sendo a casa, assim, transformada em residência real.","Augusto Malta,FOTOGRAFIA/ Papel",1930,1925/1935,"<a href=""http://acervos.ims.com.br/portals/#/detailpage/7002>Instituto Moreira Salles</a>",nan,"28,2","22,2"
940,007A5P4F02-030,Teatro Apolo,"Antigo Teatro Apolo, à rua do Lavradio, propriedade do laborioso e competente empresário teatral Celestino Silva, que legou o prédio do dito teatro à prefeitura para ser transformado numa escola. A disposição testamentária foi cumprida, inaugurando-se a escola em  3 de setembro de 1921, com solenidade. No Apolo funcionaram ótimas companhias nacionais e estrangeiras - notadamente portuguesas de operetas - num conjunto harmônico e de alto nível artístico. O teatro Apolo foi construído em 1890. Celestino Silva, que faleceu em 5 de setembro de 1916, além do legado do prédio deixou cerca de 300 contos de réis para as obras de transformação. A escola tem o nome de Celestino Silva.","Augusto Malta,FOTOGRAFIA/ Papel",1920,08-09-1920,"<a href=""http://acervos.ims.com.br/portals/#/detailpage/6588>Instituto Moreira Salles</a>",nan,"17,7","23,3"
941,007A5P4F02-036,Avenida Beira Mar,"Bairro tradicional do Rio desde o século XIX, Botafogo cresceu muito depois de1880, estimulado pela inauguração dos bondes e abertura de novas ruas. Na época de Pereira Passos também sofreu inúmeras reestruturações.","Augusto Malta,FOTOGRAFIA/ Papel",1907,11-02-1907,"<a href=""http://acervos.ims.com.br/portals/#/detailpage/16730>Instituto Moreira Salles</a>",nan,nan,nan
942,007A5P4F02-038,A Escola Militar da Praia Vermelha,"A Urca só foi urbanizada no Governo Afonso Pena, 1908, quando Sampaio Correia assumiu as obras. A Praia da Saudade ganhou cais, dezenas de ruas foram pavimentadas e o edíficio da Escola de Guerra foi concluído.","Augusto Malta,FOTOGRAFIA/ Papel",1908,01-01-1908,"<a href=""http://acervos.ims.com.br/portals/#/detailpage/7004>Instituto Moreira Salles</a>",nan,"29,4","19,6"
943,007A5P4F02-043,Túnel Velho Copacabana,"Túnel Alaor Prata, mais conhecido como Túnel Velho, que liga Copacabana a Botafogo.  Até o século XIX chegava-se a Copacabana somente pelas ladeiras do Barroso (atual Tabajaras) e do Leme ou através de um percurso mais longo pela Lagoa Rodrigo de Freitas. A abertura do túnel em 1892, que seria parte do trajeto dos bondes da Cia. Jardim Botânico, foi fundamental para a ocupação da área, ainda bastante isolada da cidade. Até 1900, somente os bondes poderiam transitar pelo túnel.","Augusto Malta,FOTOGRAFIA/ Papel",1926,30-03-1926,"<a href=""http://acervos.ims.com.br/portals/#/detailpage/7006>Instituto Moreira Salles</a>",nan,nan,nan
944,007A5P4F02-065,Exposição de 1922 - Portão do Norte,"Um dos portões de entrada da Exposição Internacional do Centenário, que ocorreu em 1922 para comemorar o centenário da Independência brasileira. Segundo historiadores, é a grandiosa versão nacional das exposições internacionais promovidas no século XIX, organizadas para celebrar o ideal nacional.","Augusto Malta,FOTOGRAFIA/ Papel",1922,01-01-1922,"<a href=""http://acervos.ims.com.br/portals/#/detailpage/7007>Instituto Moreira Salles</a>",nan,"22,1","17,3"
945,007A5P4F05-038-039,O Pão de Açucar tomado do Forte do Imbuí,nan,"Marc Ferrez,FOTOGRAFIA/ Papel",1880,1875/1885,"<a href=""http://acervos.ims.com.br/portals/#/detailpage/79114>Instituto Moreira Salles</a>",nan,nan,nan
946,007A5P4F05-065,Ilha Fiscal tomada da Ilha das Cobras,nan,"Marc Ferrez,FOTOGRAFIA/ Papel",1885,1880/1890,"<a href=""http://acervos.ims.com.br/portals/#/detailpage/79115>Instituto Moreira Salles</a>",nan,nan,nan
947,007A5P4FP04-016,"Praça da Aclamação, atual Praça da Republica, a partir do Morro do Livramento","Praça da Aclamação, atual Praça da República, com o Teatro Provisório ao centro. À  esquerda, Quartel General e a cobertura das plataformas da Estrada de Ferro Dom Pedro II. À direita, a casa da Moeda.","Georges Leuzinger,FOTOGRAFIA/ Papel",1870,1865/1875,"<a href=""http://acervos.ims.com.br/portals/#/detailpage/79116>Instituto Moreira Salles</a>",nan,"20,0","15,5"
948,007A5P4FP04-018,"Andaraí, a partir da Estrada Velha da Tijuca",nan,"Georges Leuzinger,FOTOGRAFIA/ Papel",1865,1860/1870,"<a href=""http://acervos.ims.com.br/portals/#/detailpage/79117>Instituto Moreira Salles</a>","<a href=""http://www.wikidata.org/entity/Q14942956>Tijuca Forest</a>",nan,nan
949,007A5P4FP04-020,Bela Vista,nan,"Georges Leuzinger,FOTOGRAFIA/ Papel",1865,1860/1870,"<a href=""http://acervos.ims.com.br/portals/#/detailpage/79118>Instituto Moreira Salles</a>",nan,nan,nan
950,007A5P4FP04-021,Bela Vista,nan,"Georges Leuzinger,FOTOGRAFIA/ Papel",1865,1860/1870,"<a href=""http://acervos.ims.com.br/portals/#/detailpage/79119>Instituto Moreira Salles</a>",nan,nan,nan
951,007A5P4FP04-022,"Bela Vista, vista do Morro Conde da Sé",nan,"Georges Leuzinger,FOTOGRAFIA/ Papel",1865,1860/1870,"<a href=""http://acervos.ims.com.br/portals/#/detailpage/79120>Instituto Moreira Salles</a>",nan,nan,nan
952,007A6P3F02-010,Docas da alfândega e Igreja da Candelária,"Em primeiro plano, uma das muitas lanchas a vapor que circundavam pela Baía para o transporte de passageiros. Em segundo plano as Docas, e à direita, a antiga Capitania dos Portos e a Secretaria da Marinha. Ao fundo a Igreja da Nossa Senhora da Candelária.","Marc Ferrez,FOTOGRAFIA/ Papel",1880,1875/1885,"<a href=""http://acervos.ims.com.br/portals/#/detailpage/79121>Instituto Moreira Salles</a>",nan,"22,1","16,4"
953,007A6P3F03-020,Santa Casa da Misericórdia do Rio de Janeiro,"Hospital da Misericórdia na Praia de Santa Luzia (que leva esse nome por conta do mar, que ia até quase a porta do hospital). Foi fundada por José de Anchieta, por volta de 1552. O projeto do edifício era de Domingos Monteiro, posteriormente modificado por José Jacinto Rabelo. Fotografia de grande apuro técnico pela ausência de distorção e grande sentido de perspectiva.","Marc Ferrez,REPRODUÇÃO FOTOMECÂNICA/ Papel",1895,1890/1900,"<a href=""http://acervos.ims.com.br/portals/#/detailpage/79122>Instituto Moreira Salles</a>",nan,nan,nan
954,007A6P3F03-049,Ipanema vista do Arpoador,"Foto provavelmente tirada do Arpoador, divisa entre Ipanema e Copacabana. A imagem mostra toda a extensão da praia de Ipanema até o Leblon. Ao fundo, a pedra da Gávea e o morro dos Dois Irmãos. os primeiros bondes que percorrem o bairro datam de 1902.","Marc Ferrez,REPRODUÇÃO FOTOMECÂNICA/ Papel",1906,1903/1909,"<a href=""http://acervos.ims.com.br/portals/#/detailpage/79124>Instituto Moreira Salles</a>",nan,nan,nan
955,007ALA022,Vista aérea da Praça Mauá e da Avenida Rio Branco (antiga Avenida Central),nan,"Jorge Kfuri,FOTOGRAFIA/ Papel",1921,1916/1926,"<a href=""http://acervos.ims.com.br/portals/#/detailpage/82476>Instituto Moreira Salles</a>",nan,"17,0","12,1"
956,007ALA050,"Vista aérea do bairro da Glória, destaque para Igreja Nossa Senhora da Glória do Outeiro",nan,"Jorge Kfuri,FOTOGRAFIA/ Papel",1921,1916/1926,"<a href=""http://acervos.ims.com.br/portals/#/detailpage/82494>Instituto Moreira Salles</a>","<a href=""http://www.wikidata.org/entity/Q1532671>Glória</a>","17,2","12,2"
957,007ALA110,Vista aérea da praia de Copacabana,nan,"Jorge Kfuri,FOTOGRAFIA/ Papel",1921,1916/1926,"<a href=""http://acervos.ims.com.br/portals/#/detailpage/82555>Instituto Moreira Salles</a>",nan,"17,2","12,2"
958,007ALA112,Vista aérea das praias de Copacabana e de Ipanema,nan,"Jorge Kfuri,FOTOGRAFIA/ Papel",1921,1916/1926,"<a href=""http://acervos.ims.com.br/portals/#/detailpage/82559>Instituto Moreira Salles</a>",nan,"17,1","12,2"
959,013RJ001004,"Vista do Rio de Janeiro, tendo o Gasômetro em primeiro plano","A fábrica do Barão de Mauá perto do Canal do Mangue chamava-se oficialmente Companhia de Iluminação a Gás, e, em 1865, foi vendida para uma empresa canadense, que assumiu o serviço de gás através da Rio de Janeiro Gas Company Limited. Em 1876 a concessão do abastecimento de gás passou para a empresa belga Société Anonyme du Gaz (SAG) que por sua vez passou a ser controlada pela The Rio de Janeiro Tramway Light and Power Company Limited (Light) a partir de 1910. Para ampliar a produção de gás na cidade, a SAG decidiu construir, em 1911, uma nova fábrica no bairro de São Cristóvão. É esta fábrica que podemos ver na fotografia de Malta.","Augusto Malta,FOTOGRAFIA/ Papel",1926,1920/1932,"<a href=""http://acervos.ims.com.br/portals/#/detailpage/78550>Instituto Moreira Salles</a>","<a href=""http://www.wikidata.org/entity/Q2408175>São Cristóvão</a>",nan,nan
960,013RJ001005,Substituição da iluminação pública de gás para lâmpadas incandescentes,"A partir de 1907, quando a empresa canadense Light ganhou a concessão do governo para distribuir energia elétrica para a cidade, é que a iluminação pública começou a ser modificada, transformando a luz à gás para luz incandescente. Conhecida como polvo canadense pela população carioca, a empresa monopolizou não apenas a distribuição elétrica, mas foi aos poucos tomando conta do transporte público dos bondes e das linhas telefônicas.","Augusto Malta,FOTOGRAFIA/ Papel",1921,01-01-1921,"<a href=""http://acervos.ims.com.br/portals/#/detailpage/16995>Instituto Moreira Salles</a>","<a href=""http://www.wikidata.org/entity/Q10353330>Praça Mauá</a>","16,5","23,0"
961,013RJ001009,Avenida Vieira Souto - depois da substituição da iluminação pública de gás para lâmpadas incandescentes,nan,"Augusto Malta,FOTOGRAFIA/ Papel",1921,10-02-1921,"<a href=""http://acervos.ims.com.br/portals/#/detailpage/78551>Instituto Moreira Salles</a>","<a href=""http://www.wikidata.org/entity/Q3375097>Avenida Vieira Souto</a>",nan,nan
962,013RJ001010,"Avenida Rio Branco, após substituição da iluminação a gás por lâmpadas incandescentes; ao fundo, o Palácio Monroe","Obra importante no projeto modernizador de Pereira Passos à cidade. A Avenida Central, que depois veio a ser Rio Branco, corta o centro do Rio e foi inaugurada em 1905. Na avenida estão prédios importantes como o Teatro Municipal e a Biblioteca Nacional.","Augusto Malta,FOTOGRAFIA/ Papel",1920,1930/1932,"<a href=""http://acervos.ims.com.br/portals/#/detailpage/19233>Instituto Moreira Salles</a>",nan,"29,0","21,0"
963,013RJ006038,"Av. Central, atual Rio Branco - um ano após a inauguração da instalação de iluminação incandescente",Obra importante no projeto modernizador de Pereira Passos à cidade. A Avenida Central corta o centro do Rio e foi inaugurada em 1905. Na avenida estão prédios importantes como o Teatro Municipal e a Biblioteca Nacional.,"Augusto Malta,FOTOGRAFIA/ Papel",1906,01-01-1906,"<a href=""http://acervos.ims.com.br/portals/#/detailpage/18177>Instituto Moreira Salles</a>",nan,"28,5","22,0"
964,013RJ007028,Jardim Botânico com suas palmeiras imperiais,"A história do Jardim Botânico começa com a criação do Jardim da Aclimatação, por D. João VI, em 13 de junho de 1808, pouco depois da chegada da família real ao Brasil. Inicialmente para aclimatar as especiarias vindas das Índias Orientais, o jardim virou Real Horto em 1811. Especula-se que as primeiras plantas vieram das Ilhas Maurício, inclusive as famosas palmeiras, como as retratadas na foto. O primeiro exemplar de palmeira foi chamada Palma Mater, plantada pelo próprio D. João. Por isso elas ficaram popularmente conhecidas como palmeiras reais ou imperiais.","Anônimo,FOTOGRAFIA/ Papel",1909,1906/1912,"<a href=""http://acervos.ims.com.br/portals/#/detailpage/19236>Instituto Moreira Salles</a>",nan,nan,nan
965,013RJ009013,Cristo Redentor em construção,nan,"S. H. Holland,FOTOGRAFIA",1931,1930/1931,"<a href=""http://acervos.ims.com.br/portals/#/detailpage/17502>Instituto Moreira Salles</a>","<a href=""http://www.wikidata.org/entity/Q506938>Corcovado</a>","24,0","18,0"
966,013RJ011009,Vista do Rio de Janeiro tomada do morro do Corcovado,"Entrada da baía de Guanabara, em fotografia feita por Malta do alto do Morro do Corcovado. O Corcovado está situado na Serra da Carioca e faz parte do Parque Nacional da Tijuca. No século XVI recebeu dos portugueses o nome de Pináculo (ou Pico) da Tentação, numa alusão a um monte bíblico. Somente no século XVIII é que foi rebatizado como Corcovado, por causa de sua forma alusiva a uma corcova ou corcunda.  Na época do registro ainda não havia a estátua do Cristo Redentor, inaugurada somente em 12 de outubro de 1931. Vemos ainda no centro da imagem o morro do Pão de Açúcar e, à direita, o bairro de Botafogo.","Augusto Malta,FOTOGRAFIA/ Papel",1906,01-01-1906,"<a href=""http://acervos.ims.com.br/portals/#/detailpage/16833>Instituto Moreira Salles</a>",nan,"28,5","22,6"
967,013RJ011019,"Praça XV de Novembro, Cais Pharoux e chafariz do mestre Valentim","O Cais Pharoux recebeu este nome por causa do francês Luís Adolfo Pharoux, que veio para o Brasil na época da Santa Aliança e instalou um hotel na rua Fresca (depois rua Clapp e, com o hotel, rua Pharoux), na esquina do Largo do Paço, com janelas que davam para o mar e uma ponte própria para o desembarque de passageiros. Na praia do Largo do Paço o vice-rei Luís Vasconcelos mandou construir, em 1779, um cais semelhante ao que havia em Lisboa. Acabou sendo parcialmente destruído pela violência das ondas que nele batiam. Sua primeira remodelação foi no reinado de D. João VI, em que novos aterros fizeram com que fosse para frente, e ganhou definitivamente  o nome de Pharoux. Era da ponte do Hotel Pharoux que saíam as barcas que faziam a travessia do Rio para Niterói.","Augusto Malta,FOTOGRAFIA/ Papel",1906,01-01-1906,"<a href=""http://acervos.ims.com.br/portals/#/detailpage/16998>Instituto Moreira Salles</a>",nan,"28,8","21,0"
968,013RJ011039,Passeio Público na Lapa - vendo-se os bondes da Cia. Jardim Botânico,"Passeio Público é o primeiro parque público do Brasil, uma imensa área verde bem no centro da cidade. Originalmente obra urbanística de Mestre Valentim, que planejou e executou o jardim, a fonte dos jacarés e as pirâmides, que ainda permanecem. Foi reformado pelo arquiteto e  paisagista Auguste Marie Glaziou em 1862.","Augusto Malta,FOTOGRAFIA/ Papel",1906,01-01-1906,"<a href=""http://acervos.ims.com.br/portals/#/detailpage/16999>Instituto Moreira Salles</a>",nan,"28,","22,0"
969,013RJ011040,Pedra da Gávea,"A Pedra da Gávea se levanta quase na beira do mar, entre a desembocadura do rio Cachoeira e a Ponta do Maciço. Faz parte do Maciço da Tijuca, e recebeu esse nome dos portugueses, que quando a viram do mar a acharam parecida com uma gávea (ponto de observação) de veleiro antigo.","Augusto Malta,FOTOGRAFIA/ Papel",1906,01-01-1906,"<a href=""http://acervos.ims.com.br/portals/#/detailpage/17000>Instituto Moreira Salles</a>",nan,"28,5","22,2"
970,013RJ011054,Vista da avenida Beira Mar com o Corcovado e pedra da Gávea ao fundo,"A Avenida Beira Mar, que liga o centro à zona sul da cidade, começou a ser planejada em 1903 pelo prefeito Pereira Passos, o mesmo que planejou a abertura da Avenida Central (atual Rio Branco), que na época ainda estava pela metade. Passos a imaginou como a Promenade des Anglais, em Nice, na França, e também como um prolongamento da Rio Branco. A avenida contornaria a baía até o fim de Botafogo, partindo do antigo Cais da Glória ou Praia das Areias de Espanha. Foi inaugurada em 1905, adornada por colunetas que foram destruídas por ressacas. Vemos na foto também o bairro da Glória após a re-urbanização empreendida também por Pereira Passos. Ao fundo está a Lapa e, à direita, o Palácio Monroe.","Augusto Malta,FOTOGRAFIA/ Papel",1906,12-11-1906,"<a href=""http://acervos.ims.com.br/portals/#/detailpage/17281>Instituto Moreira Salles</a>",nan,"28,5","22,6"
971,014AAN00501,"Leme, visto do morro do Inhangá",nan,"Anônimo,FOTOGRAFIA/ Papel",1907,01-01-1907,"<a href=""http://acervos.ims.com.br/portals/#/detailpage/17004>Instituto Moreira Salles</a>",nan,"23,0","17,3"
972,014AAN00502,"Pedras de Inhangá, formação rochosa que demarcava a separação das praias de Copacabana e do Leme","Esta formação rochosa ficava localizada nas proximidades da atual rua República do Peru, O morro do Inhangá foi parcialmente demolido, na década de 1920. Em 1934, o costão rochoso do morro que dava para a avenida Atlântica também foi parcialmente cortado e  demolido totalmente em 1951, para a construção dos edifícios Chopin, Balada e Prelúdio. Hoje resta apenas uma parte do morro próxima à praça Cardeal Arcoverde.","Anônimo,FOTOGRAFIA/ Papel",1907,01-01-1907,"<a href=""http://acervos.ims.com.br/portals/#/detailpage/67597>Instituto Moreira Salles</a>",nan,23,"17,2"
973,014AAN00503,Rua Araújo Gondim,nan,"Anônimo,FOTOGRAFIA/ Papel",1907,01-01-1907,"<a href=""http://acervos.ims.com.br/portals/#/detailpage/67604>Instituto Moreira Salles</a>",nan,"23,1","17,1"
974,014AAN00504,Morro da Vigia,nan,"Anônimo,FOTOGRAFIA/ Papel",1907,01-01-1907,"<a href=""http://acervos.ims.com.br/portals/#/detailpage/67603>Instituto Moreira Salles</a>",nan,"23,1","17,1"
975,014AAN00506,Praça Sacopenapan,Atual praça Cardeal Arcoverde.,"Anônimo,FOTOGRAFIA/ Papel",1907,01-01-1907,"<a href=""http://acervos.ims.com.br/portals/#/detailpage/67605>Instituto Moreira Salles</a>",nan,"23,1","17,1"
976,014AAN00507,Rua Gustavo Sampaio,nan,"Anônimo,FOTOGRAFIA/ Papel",1907,01-01-1907,"<a href=""http://acervos.ims.com.br/portals/#/detailpage/17002>Instituto Moreira Salles</a>",nan,"23,1","17,1"
977,014AAN00508,Rua Tonelero,nan,"Anônimo,FOTOGRAFIA/ Papel",1907,01-01-1907,"<a href=""http://acervos.ims.com.br/portals/#/detailpage/67606>Instituto Moreira Salles</a>",nan,"23,1","17,1"
978,014AAN00509,Restaurante Belle-Vue,nan,"Anônimo,FOTOGRAFIA/ Papel",1907,01-01-1907,"<a href=""http://acervos.ims.com.br/portals/#/detailpage/67607>Instituto Moreira Salles</a>",nan,"23,1","17,1"
979,014AAN00510,Praia de Copacabana até a igrejinha,nan,"Anônimo,FOTOGRAFIA/ Papel",1907,01-01-1907,"<a href=""http://acervos.ims.com.br/portals/#/detailpage/67609>Instituto Moreira Salles</a>",nan,"23,1","17,1"
980,014AAN00511,Parte da rua Tonelero,nan,"Anônimo,FOTOGRAFIA/ Papel",1907,01-01-1907,"<a href=""http://acervos.ims.com.br/portals/#/detailpage/67610>Instituto Moreira Salles</a>",nan,"23,1","17,1"
981,014AAN00512,Rua Gustavo Sampaio,nan,"Anônimo,FOTOGRAFIA/ Papel",1907,01-01-1907,"<a href=""http://acervos.ims.com.br/portals/#/detailpage/67608>Instituto Moreira Salles</a>",nan,"23,1","17,1"
982,014AAN00513,Morro da rua Tonelero,nan,"Anônimo,FOTOGRAFIA/ Papel",1907,01-01-1907,"<a href=""http://acervos.ims.com.br/portals/#/detailpage/67611>Instituto Moreira Salles</a>",nan,"23,1","17,1"
983,014AAN00514,Panorama de Copacabana,nan,"Anônimo,FOTOGRAFIA/ Papel",1907,01-01-1907,"<a href=""http://acervos.ims.com.br/portals/#/detailpage/67612>Instituto Moreira Salles</a>",nan,"23,1","17,1"
984,014AAN00515,Vista do Leme,nan,"Anônimo,FOTOGRAFIA/ Papel",1907,01-01-1907,"<a href=""http://acervos.ims.com.br/portals/#/detailpage/67598>Instituto Moreira Salles</a>",nan,"23,","17,1"
985,014AAN00516,Entrada do túnel novo,nan,"Anônimo,FOTOGRAFIA/ Papel",1907,01-01-1907,"<a href=""http://acervos.ims.com.br/portals/#/detailpage/67602>Instituto Moreira Salles</a>",nan,"23,0","17,3"
986,014AAN00517,Copacabana,nan,"Anônimo,FOTOGRAFIA/ Papel",1907,01-01-1907,"<a href=""http://acervos.ims.com.br/portals/#/detailpage/67613>Instituto Moreira Salles</a>",nan,"23,1","17,1"
987,014AAN00518,Vista da rua Nossa Senhora de Copacabana e praia,nan,"Anônimo,FOTOGRAFIA/ Papel",1907,01-01-1907,"<a href=""http://acervos.ims.com.br/portals/#/detailpage/67599>Instituto Moreira Salles</a>",nan,"23,","17,1"
988,014AAN00519,Restaurante Avenida Atlântica,nan,"Anônimo,FOTOGRAFIA/ Papel",1907,01-01-1907,"<a href=""http://acervos.ims.com.br/portals/#/detailpage/67614>Instituto Moreira Salles</a>",nan,"23,1","17,1"
989,014AAN00520,Morro da Igrejinha,nan,"Anônimo,FOTOGRAFIA/ Papel",1907,01-01-1907,"<a href=""http://acervos.ims.com.br/portals/#/detailpage/17005>Instituto Moreira Salles</a>",nan,"22,9","17,2"
990,014AAN00521,Morro do Inhangá,"Esta formação rochosa ficava localizada nas proximidades da atual rua República do Peru, O morro do Inhangá foi parcialmente demolido, na década de 1920. Em 1934, o costão rochoso do morro que dava para a avenida Atlântica também foi parcialmente cortado e demolido totalmente  em 1951, para a construção dos edifícios Chopin, Balada e Prelúdio. Hoje resta apenas uma parte do morro próxima à praça Cardeal Arcoverde.","Anônimo,FOTOGRAFIA/ Papel",1907,01-01-1907,"<a href=""http://acervos.ims.com.br/portals/#/detailpage/67601>Instituto Moreira Salles</a>",nan,"23,1","17,2"
991,014AAN00522,Praia do Leme,nan,"Anônimo,FOTOGRAFIA/ Papel",1907,01-01-1907,"<a href=""http://acervos.ims.com.br/portals/#/detailpage/17001>Instituto Moreira Salles</a>",nan,23,"17,2"
992,014AAN00523,Rua Barata Ribeiro,nan,"Anônimo,FOTOGRAFIA/ Papel",1907,01-01-1907,"<a href=""http://acervos.ims.com.br/portals/#/detailpage/67615>Instituto Moreira Salles</a>",nan,"23,1","17,1"
993,014AAN00524,Vista de Copacabana a partir do morro da Igrejinha,nan,"Anônimo,FOTOGRAFIA/ Papel",1907,01-01-1907,"<a href=""http://acervos.ims.com.br/portals/#/detailpage/17006>Instituto Moreira Salles</a>",nan,"23,0","17,1"
994,014AAN00525,Praia de Copacabana vista do morro da Igrejinha,nan,"Anônimo,FOTOGRAFIA/ Papel",1907,01-01-1907,"<a href=""http://acervos.ims.com.br/portals/#/detailpage/67600>Instituto Moreira Salles</a>",nan,"22,9","17,1"
995,014AM001006,Praça Mauá,nan,"Augusto Malta,FOTOGRAFIA/ Papel",1914,20-03-1914,"<a href=""http://acervos.ims.com.br/portals/#/detailpage/78653>Instituto Moreira Salles</a>","<a href=""http://www.wikidata.org/entity/Q2946148>Centro</a>","22,6","16,2"
996,014AM001009,"Avenida Beira Mar, ao fundo o Morro do Corcovado",nan,"Augusto Malta,FOTOGRAFIA/ Papel",1906,12-11-1906,"<a href=""http://acervos.ims.com.br/portals/#/detailpage/78654>Instituto Moreira Salles</a>","<a href=""http://www.wikidata.org/entity/Q894624>Botafogo (Bairro)</a>","22,6","16,2"
997,014AM001010,Avenida Beira Mar com o Pão de Açúcar ao fundo,nan,"Augusto Malta,FOTOGRAFIA/ Papel",1906,21-12-1906,"<a href=""http://acervos.ims.com.br/portals/#/detailpage/78652>Instituto Moreira Salles</a>",nan,"22,6","16,2"
998,014AM001011,"Vista de Botafogo a partir do Alto da Boa Vista, com o Pão de Açúcar ao fundo",nan,"Augusto Malta,FOTOGRAFIA/ Papel",1906,11-07-1906,"<a href=""http://acervos.ims.com.br/portals/#/detailpage/78655>Instituto Moreira Salles</a>",nan,"22,6","16,2"
999,014AM001012,Praça XV de Novembro,nan,"Augusto Malta,FOTOGRAFIA/ Papel",1907,01-01-1907,"<a href=""http://acervos.ims.com.br/portals/#/detailpage/17008>Instituto Moreira Salles</a>","<a href=""http://www.wikidata.org/entity/Q2946148>Centro</a>","27,8","21,9"
1000,014AM001013,Pelotão de ciclistas da marinha em frente ao palácio Monroe,nan,"Augusto Malta,FOTOGRAFIA/ Papel",1908,01-01-1908,"<a href=""http://acervos.ims.com.br/portals/#/detailpage/17009>Instituto Moreira Salles</a>","<a href=""http://www.wikidata.org/entity/Q2946148>Centro</a>","22,6","17,2"
1001,014AM002002,"Obra de prolongamento da rua Guanabara, atual rua Pinheiro Machado",nan,"Augusto Malta,FOTOGRAFIA/ Papel",1914,08-05-1914,"<a href=""http://acervos.ims.com.br/portals/#/detailpage/78656>Instituto Moreira Salles</a>","<a href=""http://www.wikidata.org/entity/Q727335>Laranjeiras</a>","23,7","17,8"
1002,014AM002003,Praça da Harmonia,nan,"Augusto Malta,FOTOGRAFIA/ Papel",1908,24-03-1908,"<a href=""http://acervos.ims.com.br/portals/#/detailpage/17011>Instituto Moreira Salles</a>","<a href=""http://www.wikidata.org/entity/Q3757943>Gamboa</a>","22,1","14,1"
1003,014AM002004,"Populares na rua Senhor dos Passos, esquina com a rua José Maurício, atual Tomé de Souza; ao fundo, o Campo de Santana",nan,"Augusto Malta,FOTOGRAFIA/ Papel",1913,01-01-1913,"<a href=""http://acervos.ims.com.br/portals/#/detailpage/78617>Instituto Moreira Salles</a>","<a href=""http://www.wikidata.org/entity/Q2946148>Centro</a>","17,9","23,1"
1004,014AM002005,Cortejo fúnebre do prefeito Pereira Passos,nan,"Augusto Malta,FOTOGRAFIA/ Papel",1913,31-05-1913,"<a href=""http://acervos.ims.com.br/portals/#/detailpage/19253>Instituto Moreira Salles</a>",nan,"24,0","18,0"
1005,014AM002007,Cortejo fúnebre do prefeito Pereira Passos,nan,"Augusto Malta,FOTOGRAFIA/ Papel",1913,31-05-1913,"<a href=""http://acervos.ims.com.br/portals/#/detailpage/19250>Instituto Moreira Salles</a>",nan,"23,5","17,3"
1006,014AM002008,Cortejo fúnebre do prefeito Pereira Passos,nan,"Augusto Malta,FOTOGRAFIA/ Papel",1913,31-05-1913,"<a href=""http://acervos.ims.com.br/portals/#/detailpage/19251>Instituto Moreira Salles</a>",nan,"23,6","17,5"
1007,014AM002011,Ligação das ruas Guanabara e Farani,nan,"Augusto Malta,FOTOGRAFIA/ Papel",1914,14-08-1914,"<a href=""http://acervos.ims.com.br/portals/#/detailpage/17012>Instituto Moreira Salles</a>","<a href=""http://www.wikidata.org/entity/Q10364907>Q10364907</a>","22,6","17,6"
