,id,_title,_description,keywords,year,_date,_source,_depicts,_width,_height
623,0071824cx098-03,"Praça XV de Novembro, ao fundo a catedral da Sé, atual Igreja do Carmo",nan,"Marc Ferrez,NEGATIVO/ Vidro",1903,1898/1908,"<a href=""http://acervos.ims.com.br/portals/#/detailpage/77585>Instituto Moreira Salles</a>",nan,"24,0","18,0"
624,0071824cx098-06,Ilha das Flores,"Desconhecida por boa parte dos moradores da região, um dos marcos históricos da imigração no Brasil do século XIX está em São Gonçalo, onde funcionou a primeira hospedaria de imigrantes de todo o país. Nos últimos dois séculos, a ilha também abrigou um importante engenho de mandioca, foi espaço para uma pioneira experiência de criação intensiva de peixes, funcionou como presídio e depois como sede da Tropa de Reforço da Força de Fuzileiros da Esquadra do Corpo de Fuzileiros Navais, da marinha do Brasil.","Marc Ferrez,NEGATIVO/ Vidro",1885,1880/1890,"<a href=""http://acervos.ims.com.br/portals/#/detailpage/77587>Instituto Moreira Salles</a>",nan,"24,0","18,0"
625,0071824cx098-08,Panorama do centro do Rio de Janeiro a partir do Morro do Castelo,"A cidade vista a partir do Morro do Castelo, destaque para as cúpulas das igrejas da Órdem Terceira e de Nossa Senhora do Carmo, ambas na rua Direita, atual rua Primeiro de Março, e da igreja da Candelária, na atual avenida Presidente Vargas. É possível ver também o Paço Imperial, na Praça XV de Novembro.","Marc Ferrez,NEGATIVO/ Vidro",1890,1885/1895,"<a href=""http://acervos.ims.com.br/portals/#/detailpage/77588>Instituto Moreira Salles</a>","<a href=""http://www.wikidata.org/entity/Q22069014>Morro de São Bento</a>","24,0","18,0"
626,0071824cx101-07,"Praça XV de Novembro, à direita, Mercado da Praia do Peixe",nan,"Marc Ferrez,NEGATIVO/ Vidro",1905,1875/1910,"<a href=""http://acervos.ims.com.br/portals/#/detailpage/77632>Instituto Moreira Salles</a>","<a href=""http://www.wikidata.org/entity/Q10353359>Praça XV de Novembro</a>","24,0","18,0"
627,0071824cx101-09,Entrada da Baía de Guanabara,"Vista da entrada da Baía de Guanabara, tomada de Niterói (Jurujuba).","Marc Ferrez,NEGATIVO/ Vidro",1885,1880/1890,"<a href=""http://acervos.ims.com.br/portals/#/detailpage/77590>Instituto Moreira Salles</a>",nan,"24,0","18,0"
628,0071824cx101-10,Ilha da Boa Viagem,"Ilha da Boa Viagem localiza-se no interior da baía de Guanabara, na cidade de Niterói, estado do Rio de Janeiro, no Brasil.","Marc Ferrez,NEGATIVO/ Vidro",1890,1885/1895,"<a href=""http://acervos.ims.com.br/portals/#/detailpage/77591>Instituto Moreira Salles</a>","<a href=""http://www.wikidata.org/entity/Q224101>Baía de Guanabara</a>","24,0","18,0"
629,0071824cx101-11,Morro de Gragoatá com a Fortaleza de Gragoatá ao fundo,nan,"Marc Ferrez,NEGATIVO/ Vidro",1890,1885/1895,"<a href=""http://acervos.ims.com.br/portals/#/detailpage/77592>Instituto Moreira Salles</a>",nan,"24,0","18,0"
630,0071824cx106-03,"Estrada de Ferro Central do Brasil (Linha do Centro), Estação Central do Brasil, Km 0","O prédio da Estação Central da Estrada de Ferro Central do Brasil passou por reforma para ampliação em 1898. O novo projeto manteve o corpo do edifício, derrubou as duas alas laterais que possuiam apenas um andar, e subiu duas torres laterais, com dois andares cada uma. A reforma ficou pronta em 1900, mas em 16 de novembro de 1906 a ala esquerda do edifício foi destruída por um incêndio no restaurante.","Marc Ferrez,NEGATIVO/ Vidro",1903,1900/1906,"<a href=""http://acervos.ims.com.br/portals/#/detailpage/77595>Instituto Moreira Salles</a>",nan,"24,0","18,0"
631,0071824cx106-04,"Estrada de Ferro Central do Brasil (Linha do Centro), Estação Central do Brasil, Km 0","A Estrada de Ferro Central do Brasil foi uma das principais ferrovias do Brasil, ligando Rio de Janeiro, São Paulo e Minas Gerais. Até a Proclamação da República, em 1889, a ferrovia era denominava Estrada de Ferro D. Pedro II. O decreto 2895 de 9 de maio de 1890 aprovou a ampliação da estação, e o edifício passou a ter mais duas alas laterais. As obras foram iniciadas em 1898 e concluídas em 1900 . A imagem do prédio ainda não reformado, mas com a inscrição ""Estrada e Ferro Central do Brasil"" retrata o edifício depois da proclamação da República, em 1889, mas antes do início das reformas, em 1898","Marc Ferrez,NEGATIVO/ Vidro",1889,1889/1898,"<a href=""http://acervos.ims.com.br/portals/#/detailpage/78717>Instituto Moreira Salles</a>","<a href=""http://www.wikidata.org/entity/Q4828118>Avenida Presidente Vargas</a>","24,0","18,0"
632,0071824cx106-06,Igreja Anglicana,"A Igreja Anglicana localizava-se na Rua Evaristo da Veiga, foi construída em 1891 e demolida no início do Século XIX para reurbanização da área.","Marc Ferrez,NEGATIVO/ Vidro",1905,1900/1910,"<a href=""http://acervos.ims.com.br/portals/#/detailpage/77598>Instituto Moreira Salles</a>",nan,"18,0","24,0"
633,0071824cx106-07,Real Gabinete Português de Leitura,"""O Real Gabinete Português de Leitura teve sua origem em 1837, quando um grupo de imigrantes portugueses, a maioria comerciantes, resolveu criar uma biblioteca para ampliar os conhecimentos não só de seus sócios, mas também de outros conterrâneos que moravam no Brasil. Foi o primeiro gabinete de leitura do país. O prédio que vemos na fotografia começou a ser erguido em 1880, ano do tricentenário da morte de Camões, e a pedra fundamental foi lançada pelo imperador D. Pedro II. O projeto, em estilo manuelino, foi do arquiteto português Rafael da Silva Castro. Em 10 de setembro de 1887 o prédio foi inaugurado com a presença da Princesa Isabel e do Conde D'Eu.""","Marc Ferrez,NEGATIVO/ Vidro",1890,1885/1895,"<a href=""http://acervos.ims.com.br/portals/#/detailpage/77599>Instituto Moreira Salles</a>",nan,"18,0","24,0"
634,0071824cx109a-06,Vista da Praça XV de Novembro,"Destaque para o Chafariz do Mestre Valentim, Igreja Nossa Senhora do Carmo, Mercado da Candelária, à esquerda, e, ao fundo, a Cúpula da Igreja da Candelária.","Marc Ferrez,NEGATIVO/ Vidro",1906,1898/1911,"<a href=""http://acervos.ims.com.br/portals/#/detailpage/77620>Instituto Moreira Salles</a>","<a href=""http://www.wikidata.org/entity/Q2946148>Centro</a>","24,0","18,0"
635,0071824cx109a-07,Colégio Militar,"Colégio Militar, fundado em 1889 no bairro da Tijuca.","Marc Ferrez,NEGATIVO/ Vidro",1902,1889/1907,"<a href=""http://acervos.ims.com.br/portals/#/detailpage/77621>Instituto Moreira Salles</a>","<a href=""http://www.wikidata.org/entity/Q2107829>Tijuca</a>","24,0","18,0"
636,0071824cx111-02,Pedras de Itapuca e do Índio,nan,"Marc Ferrez,NEGATIVO/ Vidro",1884,1879/1889,"<a href=""http://acervos.ims.com.br/portals/#/detailpage/77625>Instituto Moreira Salles</a>",nan,"24,0","18,0"
637,0071824cx111-05,Pedra da Gávea,Pedra da Gávea a partir de São Conrado.,"Marc Ferrez,NEGATIVO/ Vidro",1880,1875/1885,"<a href=""http://acervos.ims.com.br/portals/#/detailpage/77633>Instituto Moreira Salles</a>","<a href=""http://www.wikidata.org/entity/Q2540325>São Conrado</a>","24,0","18,0"
638,0071824cx112-01,Liceu Literário Português,"O Liceu Literário Português, fundado em 1868, é uma instituição filantrópica que oferece cursos de extensão universitária. A primeira sede do Liceu encontrava-se na antiga Rua da Prainha (atual Praça Mauá). Um dos alunos da entidade era o imperador D.Pedro II, que assistia às aulas de Arte Náutica e de Astronomia.","Marc Ferrez,NEGATIVO/ Vidro",1885,1880/1890,"<a href=""http://acervos.ims.com.br/portals/#/detailpage/70978>Instituto Moreira Salles</a>","<a href=""http://www.wikidata.org/entity/Q10353330>Praça Mauá</a>","24,0","18,0"
639,0071824cx112-02,Arsenal da Marinha,"O Arsenal de Marinha do Rio de Janeiro é uma Organização Militar da Marinha do Brasil, fundada em 1763.","Marc Ferrez,NEGATIVO/ Vidro",1890,1885/1895,"<a href=""http://acervos.ims.com.br/portals/#/detailpage/70979>Instituto Moreira Salles</a>","<a href=""http://www.wikidata.org/entity/Q5997836>Ilha das Cobras</a>","24,0","18,0"
640,0071824cx112-03,Igreja de Nossa Senhora Mãe dos Homens,"Em 1750 foi criada a Irmandade de N.S. Mãe dos Homens, formada por pequenos comerciantes e moradores da região. A devoção à santa é originária da cidade de Lisboa, em Portugal.","Marc Ferrez,NEGATIVO/ Vidro",1885,1880/1890,"<a href=""http://acervos.ims.com.br/portals/#/detailpage/70980>Instituto Moreira Salles</a>","<a href=""http://www.wikidata.org/entity/Q10364964>Rua da Alfândega</a>","18,0","24,0"
641,0071824cx112-04,Palácio Itamaraty,"O Palácio do Itamaraty foi sede do Ministério das Relações Exteriores de 1899 a 1970, localiza-se na Rua Marechal Floriano, no centro do Rio de Janeiro.","Marc Ferrez,NEGATIVO/ Vidro",1890,1885/1895,"<a href=""http://acervos.ims.com.br/portals/#/detailpage/71081>Instituto Moreira Salles</a>","<a href=""http://www.wikidata.org/entity/Q2946148>Centro</a>","24,0","18,0"
642,0071824cx112-05,Casa de oração da Igreja Evangélica Fluminense,"Fundada em 11 de julho de 1858 pelo médico-missionário escocês de origem presbiteriana Robert Reid Kalley e sua esposa Sarah Poulton Kalley, que chegaram ao Brasil em 1855. Kalley voltou para a Escócia em 10 de julho de 1876 e então foi sucedido por João Manoel Gonçalves dos Santos no pastorado da igreja, este elaborou uma súmula doutrinária composta por 28 artigos conhecida como Breve Exposição das Doutrinas Fundamentais do Cristianismo.","Marc Ferrez,NEGATIVO/ Vidro",1890,1885/1895,"<a href=""http://acervos.ims.com.br/portals/#/detailpage/70981>Instituto Moreira Salles</a>",nan,"18,0","24,0"
643,0071824cx112-06,Igreja Matriz de Santa Rita,"O templo localizado no Largo de Santa Rita foi elevado à condição de Igreja Matriz em 30 de janeiro de 1751, com a criação da Paróquia de Santa Rita.","Marc Ferrez,NEGATIVO/ Vidro",1885,1880/1890,"<a href=""http://acervos.ims.com.br/portals/#/detailpage/71082>Instituto Moreira Salles</a>","<a href=""http://www.wikidata.org/entity/Q2946148>Centro</a>","18,0","24,0"
644,0071824cx112-07,Rua do Ouvidor,"Em 1745, a Fazenda Real adquiriu algumas casas na rua para instalar a residência dos Ouvidores. O segundo deles (1748-1750), Francisco Berquó da Silva Pereira, tornou-se conhecido, e a rua passou a ser, desde então, a Rua do Ouvidor.","Marc Ferrez,NEGATIVO/ Vidro",1890,1885/1895,"<a href=""http://acervos.ims.com.br/portals/#/detailpage/71083>Instituto Moreira Salles</a>","<a href=""http://www.wikidata.org/entity/Q2946148>Centro</a>","18,0","24,0"
645,0071824cx112-08,Ginásio Nacional,"Edificio do Ginásio Nacional, hoje colégio D. Pedro II, na Rua Marechal Floriano.","Marc Ferrez,NEGATIVO/ Vidro",1900,1898/1910,"<a href=""http://acervos.ims.com.br/portals/#/detailpage/70982>Instituto Moreira Salles</a>",nan,"24,0","18,0"
646,0071824cx112-10,Igreja São Pedro dos Clérigos,"Igreja São Pedro dos Clérigos, na antiga rua de São Pedro no centro do Rio de Janeiro, esta foi extinta para dar lugar à Avenida Presidente Vargas em 1943.","Marc Ferrez,NEGATIVO/ Vidro",1890,1885/1895,"<a href=""http://acervos.ims.com.br/portals/#/detailpage/70983>Instituto Moreira Salles</a>","<a href=""http://www.wikidata.org/entity/Q2946148>Centro</a>","18,0","24,0"
647,0071824cx112-11,Igreja de Nossa Senhora da Lapa dos Mercadores,"Igreja de Nossa Senhora da Lapa dos Mercadores, localiza-se na rua do Ouvidor, entre as ruas do Mercado e 1º de Março, erguido em 1743.","Marc Ferrez,NEGATIVO/ Vidro",1895,1890/1895,"<a href=""http://acervos.ims.com.br/portals/#/detailpage/70984>Instituto Moreira Salles</a>","<a href=""http://www.wikidata.org/entity/Q10365032>Rua do Ouvidor</a>","18,0","24,0"
648,0071824cx114-01,Pavilhão do Club de Regatas Botafogo,"No dia 1º de julho de 1894, nascia na praia de Botafogo o Club de Regatas Botafogo. O clube ganhou esse nome em homenagem à enseada do bairro onde competiam os seus barcos. A sede era em um casarão demolido, no sul da praia de Botafogo, encostado ao Morro do Pasmado, onde hoje termina a Avenida Pasteur.","Marc Ferrez,NEGATIVO/ Vidro",1900,1895/1905,"<a href=""http://acervos.ims.com.br/portals/#/detailpage/77609>Instituto Moreira Salles</a>","<a href=""http://www.wikidata.org/entity/Q894624>Botafogo (Bairro)</a>","24,0","18,0"
649,0071824cx114-02,A Glória vista a partir do Morro do Castelo,nan,"Marc Ferrez,NEGATIVO/ Vidro",1885,1880/1890,"<a href=""http://acervos.ims.com.br/portals/#/detailpage/77610>Instituto Moreira Salles</a>","<a href=""http://www.wikidata.org/entity/Q1532671>Glória</a>","24,0","18,0"
650,0071824cx114-03,A Glória vista a partir do Morro do Castelo,nan,"Marc Ferrez,NEGATIVO/ Vidro",1885,1880/1890,"<a href=""http://acervos.ims.com.br/portals/#/detailpage/77611>Instituto Moreira Salles</a>","<a href=""http://www.wikidata.org/entity/Q1532671>Glória</a>",nan,nan
651,0071824cx114-04,Vista do cais Pharoux,"Vista do cais Pharoux, Praça D. Pedro II, atual Praça XV de Novembro; ao fundo o Pão de Açúcar.","Marc Ferrez,NEGATIVO/ Vidro",1890,1885/1895,"<a href=""http://acervos.ims.com.br/portals/#/detailpage/77612>Instituto Moreira Salles</a>",nan,"24,0","18,0"
652,0071824cx114-05,Vista do cais Pharoux,"Vista do cais Pharoux, Praça D. Pedro II, atual Praça XV de novembro; ao fundo, morro do Castelo e o Pão de Açúcar.","Marc Ferrez,NEGATIVO/ Vidro",1890,1885/1895,"<a href=""http://acervos.ims.com.br/portals/#/detailpage/77613>Instituto Moreira Salles</a>",nan,"24,0","18,0"
653,0071824cx114-06,Vista do cais Pharoux,"Vista do cais Pharoux, Praça D. Pedro II, atual Praça XV de novembro; ao fundo, morro do Castelo e o Pão de Açúcar.","Marc Ferrez,NEGATIVO/ Vidro",1890,1885/1895,"<a href=""http://acervos.ims.com.br/portals/#/detailpage/77614>Instituto Moreira Salles</a>",nan,"24,0","18,0"
654,0071824cx125-01,Passeio Público,"A lagoa do Boqueirão foi aterrada com material proveniente do desmonte do pequeno Morro das Mangueiras, que se erguia onde hoje está a Rua Visconde de Maranguape, na Lapa. A tarefa de arrasar o morro, aterrar a lagoa e construir o jardim foi entregue ao Mestre Valentim da Fonseca e Silva, considerado o melhor escultor do Rio na época. O Passeio Público foi construído entre 1779 e 1783. Foi o primeiro jardim público da cidade e do país, até então existiam apenas hortas e canteiros.","Marc Ferrez,NEGATIVO/ Vidro",1880,1875/1885,"<a href=""http://acervos.ims.com.br/portals/#/detailpage/77646>Instituto Moreira Salles</a>","<a href=""http://www.wikidata.org/entity/Q2946148>Centro</a>","24,0","18,0"
655,0071824cx126-01,Enseada de Botafogo,"Vista da antiga praia de Botafogo, vendo-se o Morro do Corcovado ao fundo.","Marc Ferrez,NEGATIVO/ Vidro",1885,1880/1890,"<a href=""http://acervos.ims.com.br/portals/#/detailpage/77634>Instituto Moreira Salles</a>",nan,nan,nan
656,0071824cx126-02,"Panorama do centro do Rio de Janeiro, a partir da Ilha das Cobras, no primeiro plano a Alfândega e a torre da Candelária",nan,"Marc Ferrez,NEGATIVO/ Vidro",1890,1885/1895,"<a href=""http://acervos.ims.com.br/portals/#/detailpage/77635>Instituto Moreira Salles</a>",nan,"24,0","18,0"
657,0071824cx126-05,Igreja de São Joaquim,"Vista da Igreja de São Joaquim na antiga Rua Larga, atual avenida Marechal Floriano, erguida em 1758.","Marc Ferrez,NEGATIVO/ Vidro",1890,1885/1895,"<a href=""http://acervos.ims.com.br/portals/#/detailpage/77636>Instituto Moreira Salles</a>",nan,"18,0","24,0"
658,0071824cx126-06,Panorama do Rio de Janeiro visto a partir da Ilha das Cobras,nan,"Marc Ferrez,NEGATIVO/ Vidro",1890,1885/1895,"<a href=""http://acervos.ims.com.br/portals/#/detailpage/77637>Instituto Moreira Salles</a>",nan,"24,0","18,0"
659,0071824cx126-08,"Bairro da Lapa a partir de Santa Teresa, ao fundo o Morro do Castelo",Destaque para a Igreja Nossa Senhora do Carmo da Lapa e Igreja de Santa Luzia.,"Marc Ferrez,NEGATIVO/ Vidro",1890,1885/1895,"<a href=""http://acervos.ims.com.br/portals/#/detailpage/77638>Instituto Moreira Salles</a>",nan,"24,0","18,0"
660,0071824cx126-09,Panorama dos bairros do Flamengo e Catete,"Destaque para o Palácio do Catete, à esquerda, e para o morro do Corcovado com o mirante Chapéu do Sol ao fundo.","Marc Ferrez,NEGATIVO/ Vidro",1890,1885/1895,"<a href=""http://acervos.ims.com.br/portals/#/detailpage/77639>Instituto Moreira Salles</a>",nan,"24,0","18,0"
661,0071824cx126-10,Monumento em homenagem a Pedro Álvares Cabral,"Monumento criado por ocasião das comemorações dos 400 anos do descobrimento do Brasil, pelo escultor Rodolfo Bernardeli, em homenagem a Pedro Álvares Cabral.","Marc Ferrez,NEGATIVO/ Vidro",1902,1897/1910,"<a href=""http://acervos.ims.com.br/portals/#/detailpage/77640>Instituto Moreira Salles</a>",nan,"24,0","18,0"
662,0071824cx126-11,"Entrada da Baía de Guanabara, ao fundo o Pão de Açúcar","Vista da entrada da Baía de Guanabara, tomada de Niterói (Jurujuba).","Marc Ferrez,NEGATIVO/ Vidro",1891,1891/1891,"<a href=""http://acervos.ims.com.br/portals/#/detailpage/77641>Instituto Moreira Salles</a>","<a href=""http://www.wikidata.org/entity/Q178725>Niterói</a>","24,0","18,0"
663,0071824cx127-06,Igreja Nossa Senhora da Glória,"Por decreto imperial, em 1834, foi criada no Rio de Janeiro a freguesia de Nossa Senhora da Glória no Largo do Machado. Foi inaugurada em 17 de junho de 1842 tendo como patrono perpétuo D. Pedro II.","Marc Ferrez,NEGATIVO/ Vidro",1890,1885/1895,"<a href=""http://acervos.ims.com.br/portals/#/detailpage/77642>Instituto Moreira Salles</a>",nan,nan,nan
664,0071824cx127-07,Catedral Presbiteriana do Rio de Janeiro,"Catedral Presbiteriana localizada no Centro do Rio de Janeiro, fundada em 1862.","Marc Ferrez,NEGATIVO/ Vidro",1895,1890/1900,"<a href=""http://acervos.ims.com.br/portals/#/detailpage/77643>Instituto Moreira Salles</a>",nan,"18,0","24,0"
665,0071824cx127-08,Catedral Presbiteriana do Rio de Janeiro,"Catedral Presbiteriana localizada no Centro do Rio de Janeiro, fundada em 1862.","Marc Ferrez,NEGATIVO/ Vidro",1895,1890/1900,"<a href=""http://acervos.ims.com.br/portals/#/detailpage/77644>Instituto Moreira Salles</a>",nan,"18,0","24,0"
666,0071824cxambulantesb-05,"Ambulantes no largo do Paço, morro do Castelo ao fundo","No ano de 1900, Ferrez inicia a produção de séries de cartões postais, ampliando significativamente o alcance e o público de suas imagens. De acordo com o pesquisador Paulo Berger, o fotógrafo teria produzido cerca de 350 postais diferentes, em sua maioria de vistas do Rio de Janeiro. Na primeira série editada, com títulos e endereço do fotógrafo em francês, “Rue de S. Jose 88”,  há dois cartões que trazem duas imagens de vendedores, cada uma: “Vendeurs ambulants (de cebola e galinhas)”, “Vendeurs ambulants”(de legumes e vassoura). Tais imagens, provavelmente realizadas no final do século, pertencem a um conjunto de retratos de tipos populares das ruas do Rio, como o Cesteiro, o Funileiro, o Vassoreiro, o Mascate e os Jornaleiros, posando com suas mercadorias em frente a um fundo neutro, cuja autoria foi, durante muito tempo, atribuída exclusivamente a Ferrez. Um exame nos negativos de vidro que se encontram no acervo do Instituto Moreira Salles, revelou, entretanto, que algumas delas são assinadas por Gomes Junior, um autor desconhecido.","Gomes Junior,NEGATIVO/ Vidro",1899,1894/1904,"<a href=""http://acervos.ims.com.br/portals/#/detailpage/77652>Instituto Moreira Salles</a>",nan,"24,0","18,0"
667,0071824cxavulsos2-03,Rua da Quitanda,nan,"Marc Ferrez,NEGATIVO/ Vidro",1890,1885/1895,"<a href=""http://acervos.ims.com.br/portals/#/detailpage/77647>Instituto Moreira Salles</a>",nan,"18,0","24,0"
668,0071824cxavulsos2-04,Rua da Quitanda,nan,"Marc Ferrez,NEGATIVO/ Vidro",1890,1885/1895,"<a href=""http://acervos.ims.com.br/portals/#/detailpage/77648>Instituto Moreira Salles</a>",nan,"18,0","24,0"
669,0071824cxjulioferrez2-01,"Cine Pathé na Avenida Central, 116",nan,"Augusto Malta,NEGATIVO/ Vidro",1926,25-06-1926,"<a href=""http://acervos.ims.com.br/portals/#/detailpage/77653>Instituto Moreira Salles</a>",nan,"18,0","24,0"
670,0071824cxminas3-07,"Aqueduto da Carioca, também conhecido como Arcos da Lapa","Arcos da Lapa, já como local de passagem de bondes, durante as obras de reurbanização promovidas pelo prefeito Pereira Passos (1903-1906).","Marc Ferrez,NEGATIVO/ Vidro",1896,1896/1905,"<a href=""http://acervos.ims.com.br/portals/#/detailpage/77678>Instituto Moreira Salles</a>",nan,"24,0","18,0"
671,0071824cxpintcand-01,"Praça XV de Novembro, antiga Praça D. Pedro II",nan,"Marc Ferrez,NEGATIVO/ Vidro",1890,1885/1895,"<a href=""http://acervos.ims.com.br/portals/#/detailpage/77654>Instituto Moreira Salles</a>","<a href=""http://www.wikidata.org/entity/Q10353359>Praça XV de Novembro</a>","24,0","18,0"
672,0071824cxpintcand-03,Praça XV de Novembro,"À esquerda o Paço Imperial, à direita o Arco do Teles e, em frente, a catedral da Sé, atual Igreja do Carmo.","Marc Ferrez,NEGATIVO/ Vidro",1903,1885/1895,"<a href=""http://acervos.ims.com.br/portals/#/detailpage/77655>Instituto Moreira Salles</a>","<a href=""http://www.wikidata.org/entity/Q10353359>Praça XV de Novembro</a>","24,0","18,0"
673,0071824cxpintcand-04,"Praça XV de Novembro, ao centro, o Chafariz do Mestre Valentin",Praça XV de novembro após a reforma ocorrida durante a gestão do prefeito Pereira Passos.,"Marc Ferrez,NEGATIVO/ Vidro",1903,1885/1905,"<a href=""http://acervos.ims.com.br/portals/#/detailpage/77656>Instituto Moreira Salles</a>","<a href=""http://www.wikidata.org/entity/Q10353359>Praça XV de Novembro</a>","24,0","18,0"
674,0071824cxrio1-09,"Entrada da Baía de Guanabara, ao fundo o Pão de Açúcar","Vista da entrada da Baía de Guanabara, tomada de Niterói (Jurujuba).","Marc Ferrez,NEGATIVO/ Vidro",1885,1880/1890,"<a href=""http://acervos.ims.com.br/portals/#/detailpage/77657>Instituto Moreira Salles</a>",nan,"24,0","18,0"
675,0071824cxrio2-02_2,Morro do Corcovado tomado da Floresta da Tijuca,nan,"Marc Ferrez,NEGATIVO/ Vidro",1886,1881/1891,"<a href=""http://acervos.ims.com.br/portals/#/detailpage/77679>Instituto Moreira Salles</a>","<a href=""http://www.wikidata.org/entity/Q14942956>Tijuca Forest</a>","18,0","24,0"
676,0071824cxrio2-03,"Panorama do centro do Rio, ao fundo a Ilha Fiscal","Panorama da cidade do Rio de Janeiro, provavelmente a partir do Morro do Castelo.","Marc Ferrez,NEGATIVO/ Vidro",1890,1885/1895,"<a href=""http://acervos.ims.com.br/portals/#/detailpage/77658>Instituto Moreira Salles</a>",nan,"24,0","18,0"
677,0071824cxrio2-04,Pedra de Itapuca,"Pedra de Itapuca, em Niterói, trata-se de um monumento natural localizado entre as praias de Icaraí e das Flechas, sob a designação indígena de Itapuca (pedra furada) por haver tido, em sua forma original, um túnel natural. A pedra foi parcialmente demolida por ordens do Presidente da Província, Conselheiro Pedreira, para dar prosseguimento ao Plano de Arruamento de 1840-1841, criando uma comunicação direta entre os bairros do Ingá e Icaraí.","Marc Ferrez,NEGATIVO/ Vidro",1884,1879/1889,"<a href=""http://acervos.ims.com.br/portals/#/detailpage/77659>Instituto Moreira Salles</a>","<a href=""http://www.wikidata.org/entity/Q10352795>Praia de Icaraí</a>","24,0","18,0"
678,0071824cxrio2-05,"Mercado da Praia do Peixe, ao fundo, torres da Igreja da Ordem Terceira do Carmo",nan,"Marc Ferrez,NEGATIVO/ Vidro",1890,1880/1895,"<a href=""http://acervos.ims.com.br/portals/#/detailpage/77680>Instituto Moreira Salles</a>","<a href=""http://www.wikidata.org/entity/Q10353359>Praça XV de Novembro</a>","24,0","18,0"
679,0071824cxrio2-06,"Rua Primeiro de Março, com destaque para a Igreja de Santa Cruz dos Militares","Vista da Rua Primeiro de Março (antiga Rua Direita), à esquerda Igreja de Santa Cruz dos Militares, à direita Igreja da Ordem terceira do Carmo e ao fundo o Morro do Castelo.","Marc Ferrez,NEGATIVO/ Vidro",1890,1885/1895,"<a href=""http://acervos.ims.com.br/portals/#/detailpage/77660>Instituto Moreira Salles</a>","<a href=""http://www.wikidata.org/entity/Q2946148>Centro</a>","24,0","18,0"
680,0071824cxrio2-07,Entrada da Baía de Guanabara e Pão de Açucar,"Vista da entrada da Baía de Guanabara, tomada do Forte do Imbuí (Niterói).","Marc Ferrez,NEGATIVO/ Vidro",1885,1880/1890,"<a href=""http://acervos.ims.com.br/portals/#/detailpage/77681>Instituto Moreira Salles</a>","<a href=""http://www.wikidata.org/entity/Q10283662>Q10283662</a>","24,0","18,0"
681,0071824cxrio2-09,Procissão Marítima,Provavelmente se trata da recepção de um evento de porte internacional.,"Marc Ferrez,NEGATIVO/ Vidro",1890,1885/1895,"<a href=""http://acervos.ims.com.br/portals/#/detailpage/77662>Instituto Moreira Salles</a>","<a href=""http://www.wikidata.org/entity/Q224101>Baía de Guanabara</a>","24,0","18,0"
682,0071824cxrio2-10,Regatas na Praia de Botafogo,nan,"Marc Ferrez,NEGATIVO/ Vidro",1895,1894/1910,"<a href=""http://acervos.ims.com.br/portals/#/detailpage/77663>Instituto Moreira Salles</a>",nan,"24,0","18,0"
683,0071824cxrio2-11,"Rua Direita, atual rua Primeiro de Março","Destaque para o prédio dos Correios, em primeiro plano, e para o prédio da Bolsa de Fundos Públicos, atual CCBB, adiante.","Marc Ferrez,NEGATIVO/ Vidro",1890,1885/1895,"<a href=""http://acervos.ims.com.br/portals/#/detailpage/77664>Instituto Moreira Salles</a>","<a href=""http://www.wikidata.org/entity/Q2946148>Centro</a>","18,0","24,0"
684,0071824cxrio2-12,Enseada de Botafogo,nan,"Marc Ferrez,NEGATIVO/ Vidro",1880,1875/1885,"<a href=""http://acervos.ims.com.br/portals/#/detailpage/77665>Instituto Moreira Salles</a>",nan,nan,nan
